timestamp,tweet_text,username,all_hashtags,location,followers_count,retweet_count,favorite_count
2022-05-12 18:23:35+00:00,"b""@MrC_AndTheNews @NoobishlyF @sophielouisecc Energy bills have gone up 54% since April. We are the only country in Europe not to cap this rise.... that's pathetic. People lacking any empathy for those struggling... is pathetic.""",b'DogAteMyWookie',[],"London, UK | GT: Satans Puppet",2182,0,0
2022-05-12 18:06:48+00:00,"b""@jwojc The CAP, forged after the 2nd World War with the intention of promoting food self-sufficiency in Europe, has subsidized increasingly industrialised farming by big co's - as you said yourself! You choose what to subsidize, and CAP massively distorts the market towards meat. https://t.co/gTaRjycp3n""",b'vegardbeyer',[],Berlin,255,0,0
2022-05-12 17:19:20+00:00,b'4 titles in 5 and signing the best young number 9 in Europe. We need salary cap like NBA and draft system \xf0\x9f\x98\x82 https://t.co/D8hLx0dNNR',b'respawnedtarga1',[],,13105,5,9
2022-05-12 16:59:05+00:00,"b'@GcRevenge @MikeAmuck @JamesHemmingwa5 The song Yankee Doodle was meant to be an insult to how ""backward"" colonials were...Macaroni was a well known hat designer in Europe, ""stuck a feather in his cap and called it Macaroni""....  So we killed them...and sang the song on our way to do so.... https://t.co/H4YXurvP5g'",b'indiucky',[],On the banks of the Ohio...,1972,2,3
2022-05-12 16:02:44+00:00,"b'Sunak is talking like we expect him to solve the global economy! No all we want is to be on par with the rest of Europe and not have our Energy costs go up 54%! Why are they all lying pricks! \xf0\x9f\x98\xa1 cap the raise at 4%, have a windfall tax on their obscene profits @RishiSunak'",b'SkarlKarl',[],,288,1,2
2022-05-12 15:22:02+00:00,b'i have heard some insane rumor that  Biden is being egged on by the likes of #Fauxcahantas to price cap nat gas to US  customers and then sell at  highest price possible to Europe and Asia https://t.co/I1TxbXvPWi',b'GardinerIsland',['Fauxcahantas'],"Tobaccolot Bay, Hamptons",704,0,3
2022-05-12 15:20:37+00:00,b'Our #astonvilla Champions of Europe #commemorative #cap is available to buy from https://t.co/QnE2J8fJOb  \xc2\xa339.98 delivered \xe2\xa0\x80 #football #memorabilia\xe2\xa0\x80 #sportingmemoriesmemorabilia \xe2\xa0\x80 #villa #afc #avfc #villapark #upthevilla #astonvillafc https://t.co/sJjPgoy9GJ',b'SM_Memorabilia',"['astonvilla', 'commemorative', 'cap', 'football', 'memorabilia', 'sportingmemoriesmemorabilia', 'villa', 'afc', 'avfc', 'villapark', 'upthevilla', 'astonvillafc']","Glasgow, Scotland",376,0,0
2022-05-12 14:56:07+00:00,"b'The Norge was a semi-rigid Italian-built airship that carried out the first verified trip of any kind to the North Pole, an overflight on 12 May 1926. It was also the first aircraft to fly over the polar ice cap between Europe and America. https://t.co/zh5aqDsV4B https://t.co/XhkVWbvfwl'",b'wyvernltd',[],Worldwide,1781,0,0
2022-05-12 14:03:51+00:00,b'Spain will impose a natural gas price cap of \xe2\x82\xac40 per MWh from tomorrow until the end of the year. Spanish and European benchmarks MIBGAS and Gasunie TTF are trading at \xe2\x82\xac80 and \xe2\x82\xac106 per MWh. #naturalgas #energycrisis #quantitativeenergyeasing https://t.co/rHVfA7PPXC',b'jlishawa',"['naturalgas', 'energycrisis', 'quantitativeenergyeasing']","London, United Kingdom",195,0,0
2022-05-12 14:03:08+00:00,"b""Gazprom cuts gas to Europe, Spain and Portugal institutes natural gas price cap  so lets see ...less supply and the govt  answer is to put price caps on it   these people are so stupid they don't  know whether Abe Lincoln is dead or in hiding""",b'GardinerIsland',[],"Tobaccolot Bay, Hamptons",704,1,8
2022-05-12 13:49:27+00:00,b'By permission from mummy. https://t.co/WTcJfEzeaD https://t.co/UC5DhzgnVX https://t.co/JIAp03xbNa',b'955196',[],United Kingdom,297,0,0
2022-05-12 13:48:19+00:00,"b""We are delighted to announce that we has been shortlisted at the @IRMagazine Awards - Europe 2022, for 'Best ESG Materiality Reporting (small cap)' Congratulations to the team!  Learn more here: https://t.co/mW6CKcuLwp   #ESGreporting #investorrelations #ESG #forasmarterfuture https://t.co/ynrlHnjRev""",b'ForesightGroup',"['ESGreporting', 'investorrelations', 'ESG', 'forasmarterfuture']",UK,2156,1,1
2022-05-12 13:41:19+00:00,"b'$SHEL $EQNR $GLPEF - Gazprom cuts gas to Europe, Spain and Portugal institutes natural gas price cap https://t.co/pvpItBA6Yb'",b'MarketCurrents',[],New York,82146,1,1
2022-05-12 12:41:23+00:00,b'Spain &amp; Portugal impose a \xe2\x82\xac40/MWh price cap on natgas used to produce electricity. The European benchmark TTF gas trades at \xe2\x82\xac95/MWh.  Not sure how this is implemented to keep Asian arb open on LNG. I guess subsidies by respective Govs to utilities.  https://t.co/a8Dn9HVb9y',b'BurggrabenH',[],"Zug, Switzerland",31131,12,66
2022-05-12 12:27:23+00:00,b'@melvin_chuks @Matt83278765 @Katsumirei90 @will0ben11 @pawanKu52574141 @HannaLiubakova You know \xf0\x9f\x87\xb7\xf0\x9f\x87\xba was with the Nazis for the first part of the war? Hitler and Stalin we\xe2\x80\x99re going to carve up europe between them but Stalin pushed too far into Hitlers territory so\xf0\x9f\x87\xa9\xf0\x9f\x87\xaa attacked Russia. Stalin then came cap in hand to the allies.Otherwise he would have stuck with Hitler',b'RhiannonSussex',[],,17,0,0
2022-05-12 11:50:44+00:00,b'Our #everton champions of Europe #commemorative #cap is available to buy from https://t.co/Zsh5XFmwgb    \xc2\xa339.98 delivered  #football #memorabilia\xe2\xa0\x80 #sportingmemoriesmemorabilia \xe2\xa0\x80 #efc #goodison #theblues #merseyside #evertonfc https://t.co/MvOHIcQTUn',b'SM_Memorabilia',"['everton', 'commemorative', 'cap', 'football', 'memorabilia', 'sportingmemoriesmemorabilia', 'efc', 'goodison', 'theblues', 'merseyside', 'evertonfc']","Glasgow, Scotland",376,0,0
2022-05-12 10:47:32+00:00,b'Do you complain about the @federalreserve FED policies?  Come and see the mess Mrs @Lagarde &amp; Co. @ecb are doing here in Europe.  EUR/USD all time lows\xe2\x80\xa6 #inflation #exchangerates https://t.co/xFP1N3kdFL',b'Edelweiss_Cap',"['inflation', 'exchangerates']","Vienna, Austria",231,0,0
2022-05-12 10:17:18+00:00,"b'For #reuse to become the norm, we need a cap on single-use plastics, an introduction of binding reuse targets and economic incentives to support the transition per product category.  \xf0\x9f\x93\x9dRead our policy recommendations here: https://t.co/0oBFJp1Zt5 #getback #wechoosereuse https://t.co/CFKds21Epw'",b'zerowasteeurope',"['reuse', 'getback', 'wechoosereuse']",Brussels,22311,4,9
2022-05-12 10:14:43+00:00,"b'@varbmos @xDreamCoding @ValueAnalyst1 Toyota had a bad Q1, and ""only"" made ~$4.1bn (533 billion yen)  You know that VW and BMW each made &gt;$6bn profit in Q1?  You could buy all three of those companies for less than half of Tesla\'s market cap. VW is the undisputed BEV leader in Europe too.'",b'SpeedflyChris',[],"Glasgow, Scotland",81,0,0
2022-05-12 10:07:35+00:00,b'\xf0\x9f\x87\xab\xf0\x9f\x87\xb7\xf0\x9f\x9b\xb0\xef\xb8\x8f\xf0\x9f\x9a\x9cSerco Europe has won its first Space contract in #France to support the French public authority Service and Payment Agency\xe2\x80\x99s (ASP) work for the Common #Agriculture Policy (CAP).  Read more about this innovative service #SercoinSpace\xe2\xac\x87\xef\xb8\x8f: https://t.co/DfPwrI7a1z',b'Serco_Europe',"['France', 'Agriculture', 'SercoinSpace']","Brussels, Belgium",941,1,2
2022-05-12 09:55:41+00:00,b'Our Aberdeen Champions of Europe #commemorative #cap is available to buy from https://t.co/SY9HwVKG5b   \xc2\xa339.98 delivered \xe2\xa0\x80 #sportingmemoriesmemorabilia #football #memorabilia #aberdeen #afc #aberdeenfc #dons #pittodrie #siralexferguson https://t.co/uHK1UqvsNj',b'SM_Memorabilia',"['commemorative', 'cap', 'sportingmemoriesmemorabilia', 'football', 'memorabilia', 'aberdeen', 'afc', 'aberdeenfc', 'dons', 'pittodrie', 'siralexferguson']","Glasgow, Scotland",376,0,0
2022-05-12 09:45:27+00:00,b'I LOVE the #RepublicofMoldova entry for #EUROVISION  About the train that once ran btw Chisinau (cap. Moldova) + Bucharest. A love note to Romania in a fusion of folk + rock in a train you can only find in East Europe.\xf0\x9f\x87\xb2\xf0\x9f\x87\xa9\xe2\x9d\xa4\xef\xb8\x8f More on @JeremyVineOn5  tomorrow https://t.co/0UyqkNaygb',b'Tessadunlop',"['RepublicofMoldova', 'EUROVISION']",London mainly,11212,3,18
2022-05-12 09:30:34+00:00,"b'@BarbaraSutton15 He knows the UK is no longer taken seriously and running out of international friends, especially in Europe, so he\xe2\x80\x99s having to go cap I hand and \xe2\x80\x98buy\xe2\x80\x99 his friends back'",b'GlynWashington1',[],Ossett UK and Brittany France,255,0,3
2022-05-12 08:53:19+00:00,b'@W00dy59 @TalkTV @GBNEWS As we don\xe2\x80\x99t have a Labour govt don\xe2\x80\x99t worry about it. Due to Brexit and a Tory govt there will be no energy cap like Europe has. As history shows the Tory\xe2\x80\x99s always look after their own ( the rich)',b'jameson4_david',[],United Kingdom,601,0,0
2022-05-12 08:48:03+00:00,b'boris johnson energy price cap pampers nappies cost of\xc2\xa0living https://t.co/sojeYSoek3',b'NzuchiTimesUSA',[],USA,575,0,0
2022-05-12 08:40:17+00:00,b'@Nator1987 @Savechip55 @GretnaServices @raymo04 @sportingintel They were top tier prior to the breach. The squad was essentially disbanded but they remained at the level and continue to do so because of the way the club is run and their culture.   A cap would ruin English footballs ability to compete in Europe and At international level.',b'BNunweek',[],,123,0,0
2022-05-12 08:05:35+00:00,"b'I can\xe2\x80\x99t see it from the train but about now we are passing Cap d\xe2\x80\x99Agde, Europe\xe2\x80\x99s largest nudist vacation destination. https://t.co/CVogExMHtV'",b'andrew_randall',[],"Berkeley, CA and Berlin, DE",2405,0,3
2022-05-12 07:05:01+00:00,"b'Pantheon also points out the energy price cap temporarily shielded UK households from the surge in enegry bills in Feb and March. On mainland Europe, full impact was felt immediately.'",b'ITVJoel',[],,36988,0,1
2022-05-12 06:11:16+00:00,"b'Having surpassed half a billion Euros, it\xe2\x80\x99s not surprising that #PSG \xe2\x82\xac503m wage bill is now the highest in Europe, ahead of Barcelona \xe2\x82\xac432m (before La Liga salary cap applied), #MCFC \xe2\x82\xac401m, #CFC \xe2\x82\xac376m, Bayern Munich \xe2\x82\xac373m, Real Madrid \xe2\x82\xac372m, #MUFC \xe2\x82\xac364m and #LFC \xe2\x82\xac355m. https://t.co/xtLI9xF5Tn'",b'SwissRamble',"['PSG', 'MCFC', 'CFC', 'MUFC', 'LFC']","Zurich, Switzerland",204617,5,7
2022-05-12 06:01:00+00:00,"b""Good Morning Europe &amp; Africa!  With a market cap of $1.169T, we are down -18.8% over the past 24h. Wagging it's tail between $26,781-$32,090 #BTC is now at $27,096 with a dominance of 44.1%.  A Fear &amp; Greed Index of 12 shows the market is extremely fearful.""",b'CoinFoxOfficial',['BTC'],Just around the #block,6,0,0
2022-05-12 05:02:31+00:00,"b'@LozzieDuff @andersostlund Concerning navel power... global warming, the melting of the ice cap, will present new challenges to Northern Europe. When passage from the Pacific to the N Atlantic will be poss via N Russia &amp; N Russ ports no longer ice bound in winter.  Norway becomes front line, not fringe'",b'Ceebee96447343',[],Northants,36,0,0
2022-05-12 03:59:21+00:00,b'@krdknight Stop spending money.   Reduce regulation to drive down costs.  Open up oil drilling permits.  Restart keystone pipeline.  Open up crp acres for grazing   Cap unemployment benefits to drive people back to work.  Ease immigration for high skilled immigrants from Europe pres resign',b'patriotGBR',[],,37,0,0
2022-05-11 22:49:34+00:00,"b'@CIS_org hacked?  Same org opposes per-country cap removal and denigrates Indian immigrants in #GCbacklog as cheap labor.  ""By contrast, immigrants educated in Western Europe, Australia, and India earn roughly the same salaries as comparable U.S. natives""  https://t.co/tHGUisLMHz'",b'ShadesOfBlueAn1',['GCbacklog'],,1426,5,6
2022-05-11 22:04:30+00:00,b'@Hardikc1998 @Rl9rl92 @BarcaUniversal @gerardromero Do u also realize that the negative salary cap was much better than it was last year when laporta came in?  Every team in Europe made losses but ours was worse cos we had a huge debt hanging over our heads.',b'Trixtian_',[],around the world,222,0,0
2022-05-11 21:53:21+00:00,"b'@SadiqKhan @PlugandPlayTC London is the like 70-80s NY. The crime cap of Europe , failed mayor and a woke embarrassing mess. He lives in a bubble \xf0\x9f\xab\xa7 and hates the UK. You will never lead as you can\xe2\x80\x99t even manage London \xf0\x9f\x98\x82 crime up, kid murder up, drugs up, woke crap up.'",b'velivel_ukstevo',[],,3,0,0
2022-05-11 21:47:31+00:00,"b""@jwojc We all know that this is as suicidal path, both for Earth and the future of farmers and farming. In other words, even if the CAP is not a food policy, perhaps it's still worthy to reconsider the EU's inaction and reduce the support for one of Europe's worst agricultural products?""",b'GuyPeer3',[],,1569,0,5
2022-05-11 21:45:56+00:00,"b""@backtolife_2022 Here in the Netherlands, all the restrictions are gone. There have been festivals and parties for a while. There in that stupid Canada they listen very well to that goofy Trudeau who here in Europe just shakes everybody's hands and walks around without a mouth cap but scares Cana""",b'PimB4',[],,15,0,0
2022-05-11 21:23:03+00:00,"b'@brilliantbusi It literally makes no sense unless every league has to follow the salary cap rule. It\'s not ""helping"" La Liga teams it\'s hurting them because we literally won\'t be able to compete in Europe in a few years if it continues.'",b'IMooWhenIPoo07',[],,60,0,8
2022-05-11 20:36:31+00:00,"b'@BernaBtnr @ErikTenHagPK he is exagerating extremist acts in Germany,bec he try to justify own position. As Turk \xc4\xb0 go everywhere in Europe, last week i rent a car in south spain, 2 months ago in france and been to several places not faced any discrimin,I wear moon/star cap.any1 can u/stand i am a Turk'",b'smk3390',[],Dü zce,98,0,2
2022-05-11 19:46:48+00:00,"b'@Antifatillidye @GordonDunsmuir @BrookingsFP @NicolaSturgeon @samanthaenergy Plus all the talk about a windfall tax will make no difference to us once the Tories get the money, the only way to help is to follow Europe and have a price cap.'",b'HendryMackenzie',[],Scotland ,3332,1,5
2022-05-11 19:06:53+00:00,"b'@btmholepressure @StreetBomber @SimpleJackCap With natty the Energy Security thesis (via Europe Russia gas dependence) and ""better than any other hydrocarbon"" thesis make it a pretty cool longer-term story.  Oil has the market cap and market mindshare, gas is quietly plugging away. Own exposure to both. I do.'",b'pickeringenergy',[],Houston,19795,0,1
2022-05-11 17:11:02+00:00,b'Look at Europe- all mkts up over 2 pct. Usa problems are of a diff kind as some results have been a big draw down. India is over reacting in my view specially in fear over mid n small cap',b'SMSHADABKALAM',[],India,395,0,1
2022-05-11 14:45:34+00:00,b'Our #nottinghamforest Champions of Europe #commemorative #cap is available at https://t.co/I6yHCmkEPL  \xc2\xa339.98 delivered  \xe2\xa0\x80 #football #memorabilia\xe2\xa0\x80 #sportingmemoriesmemorabilia \xe2\xa0\x80  #nffc #nottsforest #nottingham #forest #nffcfamily #cityground https://t.co/hTZT4BKYaW',b'SM_Memorabilia',"['nottinghamforest', 'commemorative', 'cap', 'football', 'memorabilia', 'sportingmemoriesmemorabilia', 'nffc', 'nottsforest', 'nottingham', 'forest', 'nffcfamily', 'cityground']","Glasgow, Scotland",376,0,0
2022-05-11 14:09:56+00:00,"b'$amrn.  450m market cap. With 390m cash, 500m inventory, 100m account receivable,   500m revenue in us,  plus approved in Europe for maybe 1B rev in 1year.   Should I buy ?  $xbi'",b'Skeleto47719550',[],,18,0,1
2022-05-11 13:58:48+00:00,b'#\xe2\x83\xa3SPOTLIGHT: We take a look at the discrepancies of the various salaries caps in the game in #Europe ... #Rugby \xf0\x9f\x8f\x89 #RugbyUnion\xf0\x9f\x8c\x90 @URCOfficial \xf0\x9f\x8f\x86 @ChampionsCup \xf0\x9f\x8f\x85 @premrugby \xe2\x99\xbb\xef\xb8\x8f @top14rugby \xe2\x9c\x85 \xf0\x9f\x94\x97https://t.co/bo71Y2c3Rn https://t.co/Q1aw4aU4Up',b'rugby365com',"['Europe', 'Rugby', 'RugbyUnion']",Following the oval ball!,35929,0,1
2022-05-11 13:47:31+00:00,b'Pax Lux Design HAT https://t.co/W0tO297zcZ #cap #fashion #summertime #sunshine #trend #shopping #fashionstyle #clothingstore #EUROVISION #Europe',b'lampadepaxlux',"['cap', 'fashion', 'summertime', 'sunshine', 'trend', 'shopping', 'fashionstyle', 'clothingstore', 'EUROVISION', 'Europe']","Padova, Veneto",223,0,0
2022-05-11 13:25:29+00:00,b'5000 cap venue for the whole of europe and then 600 tickets taken away for guest list - either this is fake news or harry is deluded',b'cherrybaby_H',[],cheshire,1677,0,6
2022-05-11 13:22:30+00:00,"b""@skisidjames The CAP, a system largely initiated by our 'friends' the French.  This was part of the post-war quid pro quo for to Germany to re-industrialise. In the words of the late Nicholas Ridley, 'This is all a German racket, designed to take over the whole of Europe.'""",b'GuideMeBiz',[],England and International,1319,4,5
2022-05-11 13:15:09+00:00,"b""Maybe because they own EDF? So profit from EDF's soaring prices in Europe allow them to cap fuel prices for their own citizens.  Although yes the Government can and should do more. https://t.co/zPqkmD3ftn""",b'Scottmidds_',[],"Plymouth, UK",184,0,0
2022-05-11 12:41:38+00:00,b'@Izuogukingsley_ Rm is bigger than you aje stop capping and famzing .. in europe your not even bigger than liverpool or AC so stop the cap bros',b'PresidentShiima',[],"Abuja, Nigeria",90,0,0
2022-05-11 12:40:27+00:00,"b'Democrats: produce less oil/nat gas, be green. Republicans: produce less make Dems look bad.  US producers:  ok not enough labor now, drill and cap.  The final kick:  export more to Europe. https://t.co/saJiXuFkd6'",b'AndyFanter',[],"Marion, KS",510,0,5
2022-05-11 10:09:02+00:00,"b'@JMGray80 @VillaMad3 @cashy__13 He\xe2\x80\x99s strong, good in the air and a terrific leader, but he just makes too many errors to be considered a top defender for me. His level is lower-mid table, but not good enough for a team challenging for Europe. If he was right footed, he wouldn\xe2\x80\x99t have a single England cap IMO.'",b'villa_woody1000',[],"Gloucester, England",795,0,3
2022-05-11 09:47:03+00:00,"b'autotranslation:  \xe2\x80\x9c\xf0\x9f\x94\x8c Putin uses gas and oil as a weapon of war, and Europe falls for his blackmail.   Until we have the courage to cut off Russian imports we can do two things:  1 \xe2\x83\xa3 a cap on the price paid  2 \xe2\x83\xa3 put a tariff on oil and gas \xe2\x80\x9c https://t.co/oxFB1bBCYo'",b'davidWonderland',[],Los Angeles,318,0,0
2022-05-11 09:22:12+00:00,"b""He is maybe half right.  The salary cap has had a bit to do with it too.  It's very easy to say it's relegation/promotion when you are at one of the richest clubs in France, on a big salary. With a rich history in Europe.  France also has a cap but it is larger than the Prem. https://t.co/9BAF8sOPxV""",b'jaredwright17',[],,10844,2,9
2022-05-11 09:05:28+00:00,"b""A giant fuck you to the person who thought it'd be fun to give europe a 4,9k cap venue for ono https://t.co/juhDps7ekP""",b'PaintingFleurs',[],the Netherlands | she/her | 20,1438,0,2
2022-05-11 09:01:11+00:00,"b""Football desperately needs a salary cap. In Europe's top 5 leagues, less than 12 different teams have won their respective top divisions in the past 25 years. Its literally just become a game of who can spend the most, no wonder it's in decline #PremierLeague #football #thoughts""",b'Jh_291',"['PremierLeague', 'football', 'thoughts']","Lancashire, England",16,0,0
2022-05-11 06:30:05+00:00,"b""Today, IEEP's @EstelleMidler will explain how CAP strategic plans contribute (or not) to reaching #EUGreenDeal objectives for #EUagriculture \xe2\x80\x93 with a specific focus on the current status of national #CAP and #EUFarm2Fork.   Register now for the event \xf0\x9f\x91\x89 https://t.co/1DBFF5Pg4w https://t.co/kmMvQOd3yZ""",b'IEEP_eu',"['EUGreenDeal', 'EUagriculture', 'CAP', 'EUFarm2Fork']","Brussels, Belgium",9941,1,2
2022-05-11 06:01:00+00:00,"b""Good Morning Europe &amp; Africa!  With a market cap of $1.439T, we are down -2.9% over the past 24h. Wagging it's tail between $30,187-$32,618 #BTC is now at $31,461 with a dominance of 41.6%.  A Fear &amp; Greed Index of 12 shows the market is extremely fearful.""",b'CoinFoxOfficial',['BTC'],Just around the #block,6,0,0
2022-05-11 04:50:08+00:00,"b""Even the most progressive abortion laws in European countries CAP the ability to get an abortion at 28 WEEKS!   NONE of them allows abortions up to the point of birth!  But, China and North Korea do! Think about that. \xf0\x9f\xa4\x94  BBC News - Europe's abortion rules https://t.co/vzjXB5Knxt""",b'Gigi619808',[],,8,0,0
2022-05-11 00:13:23+00:00,b'@1dtpwk_28 i\xe2\x80\x99d love the full black and green europe&amp;uk tour shirt or the bottle cap necklace from louis',b'dilflouis',[],he/they | NY | 21 ,1564,0,0
2022-05-10 23:34:18+00:00,"b""@zmiller1902 And ummm, (puts on parody red baseball cap) not for nuffin', but at the end of the day, this would have been a much shorter... thing if Europe had not decided that building solar/wind while chugging Russian natural gas for decades was more important than building 24/7 reactors.""",b'MukiEX57',[],Over The Goddamn Rainbow,252,0,0
2022-05-10 21:25:05+00:00,"b'@BBCPanorama @BBCOne @CandourTV And sex attacks are at a 50 year high in Scotland, another impressive feather in Nicola Sturgeon and the SNP,s cap! along with Scotland being at the top of the drug deaths table for the whole of Europe,and drink related deaths are at a 7 year high,go Sturgeon!!'",b'RobertB10632339',[],,2,0,1
2022-05-10 18:55:55+00:00,"b""$QQQ that's more than #europe #economy https://t.co/DvBW0TYSUr""",b'naashonomics',"['europe', 'economy']",San Jose,4052,0,0
2022-05-10 18:04:16+00:00,"b""Hello Drake. Hello Ye. I'm Alex from germany. You know I would love for you two to come to germany and you know i would pay 150\xe2\x82\xac or something for a ticket no cap so uhm yeah uhm why dont you like go do some Europe Tour or something and like haha Lanxess Arena cologne maybe haha""",b'DatBoiEnlok',[],,335,0,3
2022-05-10 17:37:35+00:00,b'@Keir_Starmer The price cap is now adopted in most of Europe  Even the US is considering one!',b'ArcherMail',[], looking at Ukraine,1760,0,8
2022-05-10 17:14:59+00:00,b'@PipSonic @SEGA @SEGA_Europe Nah ice cap',b'DavironYoutube',[],,44,0,1
2022-05-10 17:13:44+00:00,b'@SEGA @SEGA_Europe ice cap zone!',b'PinkFluffyDrag2',[],Everywhere & Nowhere,295,0,0
2022-05-10 16:31:04+00:00,"b'@DeaconOfBiology @LyiannaMarie @RealCandaceO or Christians running big pharma raising medicine prices to unreasonable amounts even the Christians in Europe had to put a cap on them. Has anyone ever audited the klan the way cullors is and cooperating? I see candace got people putting up her financials, dats $$, u go girl!'",b'itlooksbad',[],,0,0,0
2022-05-10 16:30:44+00:00,b'Our #everton champions of Europe #commemorative #cap is available to buy from https://t.co/Zsh5XFmwgb    \xc2\xa339.98 delivered  #football #memorabilia\xe2\xa0\x80 #sportingmemoriesmemorabilia \xe2\xa0\x80 #efc #goodison #theblues #merseyside #evertonfc https://t.co/S8p4v7rP35',b'SM_Memorabilia',"['everton', 'commemorative', 'cap', 'football', 'memorabilia', 'sportingmemoriesmemorabilia', 'efc', 'goodison', 'theblues', 'merseyside', 'evertonfc']","Glasgow, Scotland",376,0,0
2022-05-10 14:54:44+00:00,"b'@bloodandmud @joshgardner #SHIT Sanderson showing Olympic level lack of awareness by whinging that premiership teams can\xe2\x80\x99t compete in Europe due to the salary cap, but used to be able to because they were coached better.   TAXI for Sanderson!!   #SHITGOOD'",b'IgtIan',"['SHIT', 'SHITGOOD']",Mordor,355,0,3
2022-05-10 13:11:52+00:00,"b""@Kariskiss01 Broly I want to believe that your a smart man you think say nah USA or Europe you day we no day forgive enemy's for naija wetin you day even cap self because broly every man day fuck up but no be for church Oga if your supporting this kind of you day primitive""",b'StevenEgobuike',[],"Victoria Island, Nigeria",7,0,0
2022-05-10 12:42:45+00:00,"b""To support the #reuse transition in Europe we need: - A cap on single-use packaging - To set reuse targets  - EPR schemes - Levies for single-use - 'Fund for change' - Support for the implementation of deposit return schemes - @LarissaCopello https://t.co/6SvV5olrOx""",b'zerowasteeurope',['reuse'],Brussels,22311,4,9
2022-05-10 11:32:01+00:00,b'@susankgregory @Mij_Europe @Bec2043 @trussliz @10DowningStreet Doff the cap...',b'eve1104',[],"London, England",32,0,0
2022-05-10 08:03:35+00:00,"b'@Mij_Europe MOL just had 833 million USD EBIDTA for 2022 Q1 despite having gasoline price caps in Hungary, mostly by buying cheaper REB/Ural. Domestically he needs these price caps to remain and be financed by MOL (the nat gas price cap is financed by taxpayers like me).'",b'MarschikTamas',[],,1,0,1
2022-05-10 08:01:00+00:00,"b""On this week's Market Movers Europe with Alexander Borulev: \xe2\x9e\xa1 Rising oil demand, Russian #oil bans in focus \xe2\x9e\xa1 German #power price forecasts and price caps \xe2\x9e\xa1 Ruble payment response weighs on #gas market  Full video (3:52): https://t.co/2X4ecL5kyU https://t.co/h2agafuhrb""",b'SPGCIOil',"['oil', 'power', 'gas']",London,139387,2,0
